{
  "$schema": "http://json-schema.org/draft-07/schema#",
  "$id": "https://example.invalid/agent-skills/schema/presets.schema.json",
  "title": "Agent Skills - Presets Registry",
  "type": "object",
  "required": ["version", "presets"],
  "additionalProperties": true,
  "properties": {
    "version": { "type": "string", "pattern": "^[0-9]+\\.[0-9]+\\.[0-9]+$" },
    "updated": { "type": "string" },
    "notes": { "type": "array", "items": { "type": "string" } },
    "presets": {
      "type": "array",
      "minItems": 1,
      "items": {
        "type": "object",
        "required": ["id", "name", "description", "skills"],
        "additionalProperties": false,
        "properties": {
          "id": { "type": "string", "pattern": "^[a-z0-9]+(-[a-z0-9]+)*$" },
          "name": { "type": "string", "minLength": 2 },
          "description": { "type": "string", "minLength": 10 },
          "skills": {
            "type": "array",
            "minItems": 1,
            "uniqueItems": true,
            "items": { "type": "string" }
          }
        }
      }
    }
  }
}
